{
  "event_id": "evt-demo-0013",
  "ts": 1792285435000,
  "decoy_id": "dcy-demo-1",
  "catalogue_id": "foiled/demo-app/1.0.0",
  "decoy_kind": "sandbox",
  "generation": 1,
  "channel": "quarantine",
  "severity": "high",
  "src": { "ip": "203.0.113.7", "port": 51300 },
  "attempt_id": "att-demo-1",
  "payload_ref": "r2://foiled-evidence/t1/dcy-demo-1/att-demo-1/quarantine/c1c5d1b2f75673adc7db8fbf8bf1ab10f405dac8e71ce3cb8d7d0fef7fdeb172",
  "data": {
    "sha256": "c1c5d1b2f75673adc7db8fbf8bf1ab10f405dac8e71ce3cb8d7d0fef7fdeb172",
    "size": 27,
    "mime_guess": "text/x-shellscript",
    "guest_path": "/tmp/x.sh",
    "hook_id": "demo-app.upload-path-traversal",
    "executed": false
  }
}
