{
  "event_id": "evt-demo-0011",
  "ts": 1792285400003,
  "decoy_id": "dcy-demo-1",
  "catalogue_id": "foiled/demo-app/1.0.0",
  "decoy_kind": "sandbox",
  "generation": 1,
  "channel": "hook",
  "severity": "high",
  "src": { "ip": "203.0.113.7", "port": 51300 },
  "dst": { "ip": "10.85.1.2", "port": 8080 },
  "attempt_id": "att-demo-1",
  "hook": {
    "hook_id": "demo-app.upload-path-traversal",
    "catalogue_id": "foiled/demo-app/1.0.0",
    "cve_id": "FOILED-DEMO-0001",
    "stage": "trigger",
    "sequence_no": 1,
    "t_offset_ms": 3,
    "notes": "resolved path escaped the upload root"
  },
  "data": {
    "request_path": "/api/upload?path=../../../tmp/x.sh",
    "resolved_path": "/tmp/x.sh",
    "request_slice_sha256": "061f6e75bb4f65a2b379124cefacf9feca6570cf5b52e88419d4ab06189f13b2",
    "request_slice_len": 34
  }
}
