{
  "event_id": "evt-demo-0012",
  "ts": 1792285400005,
  "decoy_id": "dcy-demo-1",
  "catalogue_id": "foiled/demo-app/1.0.0",
  "decoy_kind": "sandbox",
  "generation": 1,
  "channel": "hook",
  "severity": "critical",
  "src": { "ip": "203.0.113.7", "port": 51300 },
  "dst": { "ip": "10.85.1.2", "port": 8080 },
  "attempt_id": "att-demo-1",
  "hook": {
    "hook_id": "demo-app.upload-path-traversal",
    "catalogue_id": "foiled/demo-app/1.0.0",
    "cve_id": "FOILED-DEMO-0001",
    "stage": "post_exploit",
    "sequence_no": 2,
    "t_offset_ms": 5,
    "file_writes": ["/tmp/x.sh"],
    "notes": "shell script written outside the upload root; never executed"
  }
}
